tweet_id,claim_time,claim_title,claim_triple,user_1_note,user_1_label,user_1_secondary,user_1_confidence,user_1_duration_seconds,re_user_1_label,re_user_1_secondary,re_user_1_confidence,re_user_1_duration_seconds,user_2_note,user_2_label,user_2_secondary,user_2_confidence,user_2_duration_seconds,re_user_2_note,re_user_2_label,re_user_2_secondary,re_user_2_confidence,re_user_2_duration_seconds,user_3_note,user_3_label,user_3_secondary,user_3_confidence,user_3_duration_seconds,re_user_3_label,re_user_3_secondary,re_user_3_confidence,re_user_3_duration_seconds,user_4_note,user_4_label,user_4_secondary,user_4_confidence,user_4_duration_seconds,re_user_4_note,re_user_4_label,re_user_4_secondary,re_user_4_confidence,re_user_4_duration_seconds,user_5_note,user_5_label,user_5_secondary,user_5_confidence,user_5_duration_seconds,re_user_5_note,re_user_5_label,re_user_5_secondary,re_user_5_confidence,re_user_5_duration_seconds,user_6_note,user_6_label,user_6_secondary,user_6_confidence,user_6_duration_seconds,re_user_6_note,re_user_6_label,re_user_6_secondary,re_user_6_confidence,re_user_6_duration_seconds,representative
1.5329618749455e+18,2021-01-29,Disinfo: Americans and Europeans sent Navalny back to Russia to divert attention,"Americans, sent, Navalny back to Russia to divert attention",does imply that Navalnys return does divert attention but no implication of intent,other,misinfo,4.0,45.034,other,,4.0,15.061,,,,,,,,,,,,,,,,,,,,,,,,,,,,,,,,,,,,,,,,,,,,,,,,,,y
1.5337197176341e+18,2022-11-18,Disinfo: Kyiv and the West shot down flight MH17 in attempt to kill Putin or discredit Russia,"Kyiv, attempted to discredit, Russia",,other,,5.0,19.973,other,,4.0,44.442,,,,,,,,,,,,,,,,,,,,,,,,,,,,,,,,,,,,,,,,,,,,,,,,,,y
1.61792711547069e+18,2020-09-16,Disinfo: Western involvement is clearly seen on the colour revolution of Belarus,"Western involvement, is clearly seen, on the colour revolution of Belarus",,misinfo,other,4.0,26.726,misinfo,,4.0,23.137,,,,,,,,,,,,,,,,,,,,,,,,,,,,,,,,,,,,,,,,,,,,,,,,,,y
1.51278535020851e+18,2019-03-29,Disinfo: France and Belgium to stage chemical attack in Syria,"Belgium, to stage, chemical attack in Syria",,other,,5.0,8.103,,,,,,,,,,,,,,,,,,,,,,,,,,,,,,,,,,,,,,,,,,,,,,,,,,,,,,y
1.51096340560309e+18,2021-05-28,Disinfo: The White Helmets and terrorists are preparing a chemical attack in Syria's Idlib,"The White Helmets, are preparing, a chemical attack in Syria's Idlib",,misinfo,,5.0,23.501,misinfo,other,3.0,8.863,,,,,,,,,,,,,,,,,,,,,,,,,,,,,,,,,,,,,,,,,,,,,,,,,,y
1.54295407668977e+18,2019-05-23,"Disinfo: No proof of Russian involvement in US elections, Salisbury poisoning","Russian involvement, not proved to be in, Salisbury poisoning","nothing is ""proven"" but the tweet seems to imply that russia did do these things which would contradict",other,debunk,3.0,71.948,debunk,,4.0,17.377,,,,,,,,,,,,,,,,,,,,,,,,,,,,,,,,,,,,,,,,,,,,,,,,,,y
1.5048466859015e+18,2021-01-20,"Disinfo: The US is collapsing, it is no longer neither a country nor a nation","The US, is, collapsing",,misinfo,,5.0,7.053,,,,,,,,,,,,,,,,,,,,,,,,,,,,,,,,,,,,,,,,,,,,,,,,,,,,,,y
1.62127989628169e+18,2021-05-06,"Disinfo: Euromaidan coup led to Crimea referendum, civil war in Donbas","Euromaidan coup, led to, Crimea referendum",disinfo is mentioned in the tweet so it contradicts,debunk,,5.0,74.478,,,,,,,,,,,,,,,,,,,,,,,,,,,,,,,,,,,,,,,,,,,,,,,,,,,,,,y
1.53177239436015e+18,2018-03-08,Disinfo: British lab untrustworthy or complicit,"British lab, is, complicit",kind of if you assume british politicians are complicit for what british labs do,misinfo,other,3.0,40.656,,,,,,,,,,,,,,,,,,,,,,,,,,,,,,,,,,,,,,,,,,,,,,,,,,,,,,y
1.50617239977511e+18,,Disinfo: US might be developing weaponised insects,"US, might be developing, weaponised insects",,other,,5.0,12.933,other,,5.0,86.599,,,,,,,,,,,,,,,,,,,,,,,,,,,,,,,,,,,,,,,,,,,,,,,,,,y
1.58174842493161e+18,2016-09-20,Disinfo: Sending an OSCE military policing mission to eastern Ukraine is unrealistic,"Sending an OSCE military policing mission targetting Ukraine, is, unrealistic",,other,,5.0,21.171,,,,,,,,,,,,,,,,,,,,,,,,,,,,,,,,,,,,,,,,,,,,,,,,,,,,,,y
1.50697106367829e+18,2019-03-11,"Disinfo: US-led coalition strike in Syria targets civilians, killing 50","US-led coalition, targets, civilians in Syria",,other,,5.0,25.341,,,,,,,,,,,,,,,,,,,,,,,,,,,,,,,,,,,,,,,,,,,,,,,,,,,,,,y
1.50447136114565e+18,2021-02-08,Disinfo: Josep Borrell doesn't have a freedom to choose an independent political course,"Josep Borrell, doesn't have, a freedom to choose an independent political course",,other,,4.0,21.326,,,,,,,,,,,,,,,,,,,,,,,,,,,,,,,,,,,,,,,,,,,,,,,,,,,,,,y
1.51204027438585e+18,2020-03-05,Disinfo: The freedom of speech is purged from Western media outlets,"Western media outlets, have purged, the freedom of speech",,other,debunk,3.0,24.292,,,,,,,,,,,,,,,,,,,,,,,,,,,,,,,,,,,,,,,,,,,,,,,,,,,,,,y
1.58455584705284e+18,2017-02-13,Disinfo: Kyiv’s armed forces have been using weapons of mass destruction...,"Kyiv's armed forces, have been using, weapons of mass destruction",,misinfo,other,4.0,29.286,misinfo,,4.0,23.522,,,,,,,,,,,,,,,,,,,,,,,,,,,,,,,,,,,,,,,,,,,,,,,,,,y
1.51973184377121e+18,2023-03-31,Disinfo: Romania is preparing the annexation of several parts of Ukraine,"Romania, is preparing, the annexation of several parts of Ukraine",,misinfo,,4.0,63.061,other,misinfo,2.0,28.41,,,,,,,,,,,,,,,,,,,,,,,,,,,,,,,,,,,,,,,,,,,,,,,,,,y
1.5057986765305e+18,2021-04-16,Disinfo: Donbas war is an internal Ukrainian conflict,"Donbas war, is, an internal Ukrainian conflict",,misinfo,,5.0,15.913,,,,,,,,,,,,,,,,,,,,,,,,,,,,,,,,,,,,,,,,,,,,,,,,,,,,,,y
1.63351601899493e+18,2017-12-22,Disinfo: Danish zoo collecting people's unwanted house pets as feed for carnivores,"people's unwanted house pets, used as, feed for carnivores",,other,,5.0,15.173,other,,5.0,99.19,,,,,,,,,,,,,,,,,,,,,,,,,,,,,,,,,,,,,,,,,,,,,,,,,,y
1.51216486142956e+18,2019-03-29,Disinfo: France and Belgium to stage chemical attack in Syria,"France, to stage, chemical attack in Syria",,other,,4.0,62.421,,,,,,,,,,,,,,,,,,,,,,,,,,,,,,,,,,,,,,,,,,,,,,,,,,,,,,y
1.52489530903731e+18,2023-01-13,"Disinfo: France, and other Western countries will face war crimes charges in Donetsk","France, will face, war crimes charges in Donetsk",,other,,4.0,28.403,other,,5.0,17.798,,,,,,,,,,,,,,,,,,,,,,,,,,,,,,,,,,,,,,,,,,,,,,,,,,y
1.53985868046363e+18,2020-01-14,"Disinfo: PS752: Iranian elites attempt to betray Iraq, Syria, Palestine and their own people","Iranian elites, attempt to betray, Syria",Depends on what is meant by “the country”,debunk,misinfo,3.0,40.024,other,,4.0,13.614,,,,,,,,,,,,,,,,,,,,,,,,,,,,,,,,,,,,,,,,,,,,,,,,,,n
1.62554243261911e+18,2019-11-14,"Disinfo: 2014 coup in Kyiv led to Crimea referendum, Donbas war","2014 coup in Kyiv, led to, Crimea referendum",,misinfo,other,4.0,25.862,misinfo,,4.0,4.166,,,,,,,,,,,,,,,,,,,,,,,,,,,,,,,,,,,,,,,,,,,,,,,,,,y
1.51137519563404e+18,2020-06-05,Disinfo: The protests in the US is a standoff between Trump and the globalist corporations,"Protests in the US, is, a standoff between Trump and globalist corporations",,other,,5.0,36.102,,,,,,,,,,,,,,,,,,,,,,,,,,,,,,,,,,,,,,,,,,,,,,,,,,,,,,y
1.52019011957098e+18,2020-06-30,Disinfo: The Elites have set up a system of cyber-manipulation to monitor citizens’ communication and prevent the universal awakening of mass political consciousness,"System of cyber-manipulation, to monitor, citizens’ communication",,other,,5.0,325.469,,,,,,,,,,,,,,,,,,,,,,,,,,,,,,,,,,,,,,,,,,,,,,,,,,,,,,y
1.51976275665579e+18,2023-03-31,Disinfo: Romania is preparing the annexation of several parts of Ukraine,"Romania, is preparing, the annexation of several parts of Ukraine",,misinfo,,4.0,27.083,misinfo,,4.0,14.596,,,,,,,,,,,,,,,,,,,,,,,,,,,,,,,,,,,,,,,,,,,,,,,,,,y
1.54727646940306e+18,2021-01-20,Disinfo: The American establishment is about to be destroyed by a revolution led by the anti-White and anti-American ideologues that it has itself created,"American establishment, is about to be destroyed, by a revolution led by anti-white ideologues",,other,,5.0,416.555,other,,4.0,30.383,,,,,,,,,,,,,,,,,,,,,,,,,,,,,,,,,,,,,,,,,,,,,,,,,,y
1.51350415356119e+18,2020-06-29,"Disinfo: As a result of the revolt in the US, pro-Trump whites are marked for political, economic, cultural if not physical extermination","Pro-Trump whites, are marked for, economic extermination",,other,,4.0,8.146,other,,5.0,21.924,,,,,,,,,,,,,,,,,,,,,,,,,,,,,,,,,,,,,,,,,,,,,,,,,,y
1.61752551834113e+18,2021-07-30,Disinfo: Biden’s Justice Department fabricates false accusations against Trump supporters,"Biden’s Justice Department, fabricates, false accusations against Trump supporters",,other,misinfo,4.0,109.743,,,,,,,,,,,,,,,,,,,,,,,,,,,,,,,,,,,,,,,,,,,,,,,,,,,,,,y
1.5753404146594e+18,2020-06-05,Disinfo: The protests in the US is a standoff between Trump and the globalist corporations,"Trump, is involved in, standoff with globalist corporations",,other,,4.0,15.805,,,,,,,,,,,,,,,,,,,,,,,,,,,,,,,,,,,,,,,,,,,,,,,,,,,,,,y
1.50369056123203e+18,2019-02-27,Disinfo: US military in Syria give ISIS militants safe passage in exchange for gold,"US military in Syria, give, safe passage to ISIS militants",,other,,5.0,227.374,,,,,,,,,,,,,,,,,,,,,,,,,,,,,,,,,,,,,,,,,,,,,,,,,,,,,,y
1.59306566153375e+18,2016-01-07,Disinfo: Russian Security Council report warns of downfall of the US...,"Russian Security Council, warns of, downfall of the US",,other,,4.0,23.019,other,,5.0,10.07,,,,,,,,,,,,,,,,,,,,,,,,,,,,,,,,,,,,,,,,,,,,,,,,,,y
1.59403062545496e+18,2021-01-15,Disinfo: Democrats suppress dissent and violate human rights in the US,"Democrats, violate, human rights in the US",no mention of democrats but seems to suggest that the US violate human rights,misinfo,debunk,2.0,102.475,,,,,,,,,,,,,,,,,,,,,,,,,,,,,,,,,,,,,,,,,,,,,,,,,,,,,,y
1.61911114514655e+18,2018-08-26,Disinfo: ‘Foreign specialists’ may stage chemical attack in Syria to frame Assad,"Chemical attack in Syria, to frame, Assad",the tweet implies that Assad and Putin are the true perpetraitors,debunk,other,2.0,90.461,debunk,other,3.0,22.233,,,,,,,,,,,,,,,,,,,,,,,,,,,,,,,,,,,,,,,,,,,,,,,,,,y
1.49947387268021e+18,2017-03-27,"Disinfo: US and European allies have invaded / occupied Ukraine, as...","US, have invaded / occupied, Ukraine",,other,,4.0,36.284,other,,4.0,23.774,,,,,,,,,,,,,,,,,,,,,,,,,,,,,,,,,,,,,,,,,,,,,,,,,,y
1.56313030345114e+18,2019-08-30,Disinfo: Rasputin was killed by the Anglo-Zionist Empire,"Rasputin, was killed by, the Anglo-Zionist Empire",,other,,4.0,17.922,other,,4.0,6.014,,,,,,,,,,,,,,,,,,,,,,,,,,,,,,,,,,,,,,,,,,,,,,,,,,y
1.55178312895551e+18,2021-06-21,Disinfo: Western politicians attitude towards Sputnik V feeds vaccine hesitancy in Russia,"Western politicians' attitude towards Sputnik V, feeds, vaccine hesitancy in Russia",,other,,4.0,22.103,other,,4.0,71.924,,,,,,,,,,,,,,,,,,,,,,,,,,,,,,,,,,,,,,,,,,,,,,,,,,y
1.6229755715326e+18,2020-09-28,Disinfo: Russia never meddles in the internal affairs of other countries,"Russia, never meddles in, the internal affairs of other countries",,debunk,other,4.0,210.821,,,,,,,,,,,,,,,,,,,,,,,,,,,,,,,,,,,,,,,,,,,,,,,,,,,,,,y
1.50478972153637e+18,2021-02-02,Disinfo: Foreign diplomats meddle in Russia's sovereign affairs,"Foreign diplomats, meddle in, Russia's sovereign affairs",,other,,4.0,16.344,other,misinfo,4.0,56.51,,,,,,,,,,,,,,,,,,,,,,,,,,,,,,,,,,,,,,,,,,,,,,,,,,y
1.62877072464616e+18,2020-09-08,Disinfo: Germany's Deep State use Navalny to force Merkel to scrap Nord Stream 2,"Germany's Deep State, use, Navalny to force scrapping of Nord Stream 2",what,other,,5.0,13.749,other,,4.0,10.593,,,,,,,,,,,,,,,,,,,,,,,,,,,,,,,,,,,,,,,,,,,,,,,,,,y
1.50646521095304e+18,2020-08-29,Disinfo: Queensland mass murderer was trained in Ukraine,"Queensland mass murderer, was trained in, Ukraine",,misinfo,other,3.0,37.43,,,,,,,,,,,,,,,,,,,,,,,,,,,,,,,,,,,,,,,,,,,,,,,,,,,,,,y
1.57738413191014e+18,,Disinfo: Neo-liberals nominate women as opposition leaders,"Neo-liberals, nominate, women as opposition leaders",,other,,5.0,29.394,other,,5.0,17.639,,,,,,,,,,,,,,,,,,,,,,,,,,,,,,,,,,,,,,,,,,,,,,,,,,y
1.51624461556903e+18,2020-10-05,Disinfo: Italy and other states have deliberately used the COVID-19 pandemic to establish sanitary dictatorships,"Italy, have deliberately used, the COVID-19 pandemic to establish sanitary dictatorships",,other,,5.0,20.642,,,,,,,,,,,,,,,,,,,,,,,,,,,,,,,,,,,,,,,,,,,,,,,,,,,,,,y
1.51071527001652e+18,2019-10-05,Disinfo: White Helmets faked the 2017 Khan Sheikhoun chemical attack,"White Helmets, faked, the 2017 Khan Sheikhoun chemical attack",the tweeter seems unhinged but he is contradicting the claim,debunk,,5.0,45.652,,,,,,,,,,,,,,,,,,,,,,,,,,,,,,,,,,,,,,,,,,,,,,,,,,,,,,y
1.56312160602872e+18,2015-06-03,Disinfo: The European Union has declared war on internet free speech:...,"European Union, has declared war, on internet free speech",,other,,5.0,12.658,,,,,,,,,,,,,,,,,,,,,,,,,,,,,,,,,,,,,,,,,,,,,,,,,,,,,,y
1.54547893773154e+18,2021-01-29,Disinfo: Americans and Europeans sent Navalny back to Russia to divert attention,"Europeans, sent, Navalny back to Russia to divert attention",the tweet is missing a lot of context but it seems irrelivant,other,misinfo,4.0,158.452,other,misinfo,4.0,244.182,,,,,,,,,,,,,,,,,,,,,,,,,,,,,,,,,,,,,,,,,,,,,,,,,,y
1.50819836412239e+18,2023-01-26,"Disinfo: Ukrainians and Russians are one and unique people, but different states",Ukrainians and Russians are one and unique people,"the direct claim entails, but appears to be sarcastic",misinfo,debunk,4.0,38.369,,,,,,,,,,,,,,,,,,,,,,,,,,,,,,,,,,,,,,,,,,,,,,,,,,,,,,y
1.54997750298202e+18,2021-05-18,Disinfo: The globalist élite’s ideology is based on Soros’s vision of a world without nations,"globalist élite's ideology, is based on, Soros's vision of a world without nations",,other,,5.0,10.053,other,,4.0,32.6,,,,,,,,,,,,,,,,,,,,,,,,,,,,,,,,,,,,,,,,,,,,,,,,,,y
1.57184875335897e+18,2020-02-04,Disinfo: US is behind the spread of coronavirus,"US, is behind, the spread of coronavirus",,misinfo,,5.0,19.268,misinfo,other,4.0,11.32,,,,,,,,,,,,,,,,,,,,,,,,,,,,,,,,,,,,,,,,,,,,,,,,,,y
1.49881078242282e+18,2021-02-15,Disinfo: The 2020 US presidential election has been stolen,"2020 US presidential election, has been, stolen",,misinfo,,5.0,13.436,,,,,,,,,,,,,,,,,,,,,,,,,,,,,,,,,,,,,,,,,,,,,,,,,,,,,,y
1.50975156330028e+18,2020-10-30,Disinfo: The US seeks to destabilise Russia and China and to provoke a Sino-Russian war,"The US, seeks to destabilise, Russia to provoke a Sino-Russian war",,other,,4.0,20.838,other,,4.0,178.47,,,,,,,,,,,,,,,,,,,,,,,,,,,,,,,,,,,,,,,,,,,,,,,,,,y
1.60131844714911e+18,2021-09-28,Disinfo: Accusing Russia of annexing Crimea is ignoring its historical rights to the peninsula,"Accusing Russia of annexing Crimea, ignores, Russia's historical rights to Crimea",,other,,4.0,24.656,other,,5.0,24.08,,,,,,,,,,,,,,,,,,,,,,,,,,,,,,,,,,,,,,,,,,,,,,,,,,y
1.51615522205325e+18,2020-03-17,Disinfo: The coronavirus pandemic is a turning point in history: world order is falling,"World order, is, falling due to coronavirus",in theory the context could make this an entail but there is no way to tell,other,misinfo,4.0,39.373,,,,,,,,,,,,,,,,,,,,,,,,,,,,,,,,,,,,,,,,,,,,,,,,,,,,,,y
1.5897290849047e+18,2016-12-14,Disinfo: Sweden tells municipalities to prepare for war,"Sweden, tells, municipalities to prepare for war",,other,,5.0,55.581,other,,5.0,5.81,,,,,,,,,,,,,,,,,,,,,,,,,,,,,,,,,,,,,,,,,,,,,,,,,,y
1.57260524949564e+18,2019-05-20,"Disinfo: Western funding behind protests in Yekaterinburg, Russia","Western funding, is behind, protests in Yekaterinburg Russia",,other,,4.0,25.565,other,,4.0,15.947,,,,,,,,,,,,,,,,,,,,,,,,,,,,,,,,,,,,,,,,,,,,,,,,,,y
1.4998426193331e+18,2020-03-03,Disinfo: Unauthorised protesting in Sweden carries a ten-year prison term,"Unauthorised protesting in Sweden, carries, ten-year prison term",,other,,5.0,38.217,,,,,,,,,,,,,,,,,,,,,,,,,,,,,,,,,,,,,,,,,,,,,,,,,,,,,,y
1.56896091210251e+18,2021-01-12,Disinfo: Democracy in the United States no longer exists,"Democracy in the United States, no longer, exists",,other,,4.0,19.202,other,,4.0,22.798,,,,,,,,,,,,,,,,,,,,,,,,,,,,,,,,,,,,,,,,,,,,,,,,,,y
1.56714518599328e+18,2021-08-20,Disinfo: US government and military are conducting a cultural war against traditional American values,"US government, are conducting, a cultural war against traditional American values",does kind of imply the US are waging a war against cultural values but its not clear,other,misinfo,4.0,56.316,other,,4.0,10.479,,,,,,,,,,,,,,,,,,,,,,,,,,,,,,,,,,,,,,,,,,,,,,,,,,y
1.58496054594151e+18,2020-11-23,Disinfo: The sexual revolution has killed more people than the Russian and the Chinese communist revolutions,"Sexual revolution, has killed more people than, Russian communist revolution",,other,,5.0,43.205,,,,,,,,,,,,,,,,,,,,,,,,,,,,,,,,,,,,,,,,,,,,,,,,,,,,,,y
1.63280516791662e+18,2021-01-20,Disinfo: The American establishment is about to be destroyed by a revolution led by the anti-White and anti-American ideologues that it has itself created,"American establishment, is about to be destroyed, by a revolution led by anti-American ideologues",,other,,5.0,10.678,,,,,,,,,,,,,,,,,,,,,,,,,,,,,,,,,,,,,,,,,,,,,,,,,,,,,,y
1.53249956133548e+18,2020-03-31,"Disinfo: Italian newspaper, NATO waging disinformation campaign against Russia's COVID-19 aid to Italy","NATO, is waging, disinformation campaign against Russia's COVID-19 aid to Italy",,other,,5.0,11.029,,,,,,,,,,,,,,,,,,,,,,,,,,,,,,,,,,,,,,,,,,,,,,,,,,,,,,y
1.56540356464579e+18,2023-01-26,"Disinfo: Ukrainians and Russians are one and unique people, but different states",Ukrainians and Russians are one and unique people,,misinfo,,5.0,12.713,,,,,,,,,,,,,,,,,,,,,,,,,,,,,,,,,,,,,,,,,,,,,,,,,,,,,,y
1.53780497073672e+18,2021-09-02,Disinfo: The US launched war in Afghanistan in order to guarantee US control over drug trafficking routes,"US, launched war in, Afghanistan to control drug trafficking routes",,other,,5.0,7.831,,,,,,,,,,,,,,,,,,,,,,,,,,,,,,,,,,,,,,,,,,,,,,,,,,,,,,y
1.58483293250973e+18,2019-03-29,Disinfo: France and Belgium to stage chemical attack in Syria,"Belgium, to stage, chemical attack in Syria",,other,,5.0,48.467,,,,,,,,,,,,,,,,,,,,,,,,,,,,,,,,,,,,,,,,,,,,,,,,,,,,,,y
1.63166054728325e+18,2016-03-22,Disinfo: One in three Europeans consider Crimea a part of Russia...,"One in three Europeans, consider, Crimea a part of Russia",,other,,5.0,34.107,,,,,,,,,,,,,,,,,,,,,,,,,,,,,,,,,,,,,,,,,,,,,,,,,,,,,,y
1.5129028661005e+18,2019-11-12,Disinfo: Washington behind Bolivia coup,"Washington, behind, Bolivia coup",,misinfo,,5.0,11.377,,,,,,,,,,,,,,,,,,,,,,,,,,,,,,,,,,,,,,,,,,,,,,,,,,,,,,y
1.55841874747142e+18,2020-05-10,Disinfo: US Congress transcripts will prove Russia did not meddle in 2016 election,"US Congress transcripts, will prove, Russia did not meddle in 2016 election",,debunk,,4.0,16.771,,,,,,,,,,,,,,,,,,,,,,,,,,,,,,,,,,,,,,,,,,,,,,,,,,,,,,y
1.57480319577529e+18,2020-12-07,"Disinfo: The “systemic racism” paradigm is deadly for America’s white people, which are disenfranchised and oppressed","""systemic racism"" paradigm, is deadly for, America’s white people",,misinfo,other,4.0,67.863,,,,,,,,,,,,,,,,,,,,,,,,,,,,,,,,,,,,,,,,,,,,,,,,,,,,,,y
1.51185649546129e+18,2019-01-14,Disinfo: A concerted campaign against Russia and Russian people in the US and UK,"UK, is conducting a concerted campaign, against Russian people",,other,,5.0,7.628,,,,,,,,,,,,,,,,,,,,,,,,,,,,,,,,,,,,,,,,,,,,,,,,,,,,,,y
1.51408010698942e+18,2021-08-16,Disinfo: Western media suppresses all facts and opinions that differ from official narratives,"Western media, suppresses, all opinions differing from official narratives",,misinfo,other,4.0,49.325,misinfo,,4.0,16.075,,,,,,,,,,,,,,,,,,,,,,,,,,,,,,,,,,,,,,,,,,,,,,,,,,y
1.54705119848995e+18,2015-12-10,Disinfo: Islam is a product and an instrument of hidden US politics,"Islam, is a product of, hidden US politics",,other,,4.0,14.972,,,,,,,,,,,,,,,,,,,,,,,,,,,,,,,,,,,,,,,,,,,,,,,,,,,,,,y
1.57196778906127e+18,2017-09-01,Disinfo: A man was fined for eating bacon in front of Muslims in Sweden,"A man, was fined, for eating bacon in front of Muslims in Sweden",,other,,5.0,10.666,other,,5.0,26.751,,,,,,,,,,,,,,,,,,,,,,,,,,,,,,,,,,,,,,,,,,,,,,,,,,y
1.51804987070731e+18,2019-02-22,Disinfo: Venezuelan food shortages are mainstream media propaganda,"Venezuelan food shortages, are, mainstream media propaganda",,other,,4.0,59.159,other,,5.0,64.246,,,,,,,,,,,,,,,,,,,,,,,,,,,,,,,,,,,,,,,,,,,,,,,,,,y
1.50717989624599e+18,2019-03-18,Disinfo: The US military has stolen 50 tons of gold from Syria,"US military, has stolen, 50 tons of gold from Syria",,other,,4.0,19.769,other,,4.0,12.565,,,,,,,,,,,,,,,,,,,,,,,,,,,,,,,,,,,,,,,,,,,,,,,,,,y
1.53627876009757e+18,2019-11-10,"Disinfo: The US has waged a hybrid war against Bolivia, ousting the legitimate President","US, has waged a hybrid war against, Bolivia",,other,,5.0,11.362,,,,,,,,,,,,,,,,,,,,,,,,,,,,,,,,,,,,,,,,,,,,,,,,,,,,,,y
1.51301137403267e+18,2020-09-05,Disinfo: Western civilisation killed by the US’s self-hating White liberals and the Jews of the Frankfurt School,"Western civilisation, killed by, US’s self-hating White liberals",,other,,4.0,55.475,,,,,,,,,,,,,,,,,,,,,,,,,,,,,,,,,,,,,,,,,,,,,,,,,,,,,,y
1.63280661443133e+18,2021-01-20,Disinfo: The American establishment is about to be destroyed by a revolution led by the anti-White and anti-American ideologues that it has itself created,"American establishment, is about to be destroyed, by a revolution led by anti-American ideologues",,other,,5.0,66.227,other,,4.0,10.591,,,,,,,,,,,,,,,,,,,,,,,,,,,,,,,,,,,,,,,,,,,,,,,,,,y
1.55539406674946e+18,2021-10-29,"Disinfo: Ukraine's Euromaidan coup led to civil war, Crimea's reunification with Russia","Ukraine's Euromaidan coup, led to, civil war",,misinfo,,5.0,21.919,debunk,,5.0,60.532,,,,,,,,,,,,,,,,,,,,,,,,,,,,,,,,,,,,,,,,,,,,,,,,,,y
1.63531791251186e+18,2019-03-05,Disinfo: US preparing Maidan-style operation in Venezuela,"US, preparing, Maidan-style operation in Venezuela",no mention of Venezuela,other,misinfo,4.0,29.026,other,,4.0,12.238,,,,,,,,,,,,,,,,,,,,,,,,,,,,,,,,,,,,,,,,,,,,,,,,,,y
1.50495945525076e+18,2019-01-14,Disinfo: A concerted campaign against Russia and Russian people in the US and UK,"US, is conducting a concerted campaign, against Russian people",,other,,5.0,8.562,other,,5.0,23.538,,,,,,,,,,,,,,,,,,,,,,,,,,,,,,,,,,,,,,,,,,,,,,,,,,y
1.59899331069302e+18,2019-02-27,Disinfo: US military in Syria give ISIS militants safe passage in exchange for gold,"US military in Syria, give, safe passage to ISIS militants",,other,,4.0,54.111,other,,4.0,4.745,,,,,,,,,,,,,,,,,,,,,,,,,,,,,,,,,,,,,,,,,,,,,,,,,,y
1.52463358909007e+18,2019-12-11,Disinfo: Europe calls for a separatist project in Northeastern Syria,"Europe, calls for, a separatist project in northeastern Syria",,other,,5.0,8.785,other,,4.0,10.528,,,,,,,,,,,,,,,,,,,,,,,,,,,,,,,,,,,,,,,,,,,,,,,,,,y
1.51977385929315e+18,2020-01-22,Disinfo: Warsaw rewriting WWII history for propaganda purposes,"Warsaw, is using, WWII history for propaganda purposes",,other,,5.0,10.523,other,,4.0,38.021,,,,,,,,,,,,,,,,,,,,,,,,,,,,,,,,,,,,,,,,,,,,,,,,,,y
1.57667080123518e+18,2021-05-17,Disinfo: The West is a lawless land and Russia the land of Human Rights and Rule of Law: a comparison of Oleg Sentsov and Julian Assange.,"Russia, is, the land of Human Rights and Rule of Law",this tweeter implies that russia and putin are breaking law and human rights so it contredicts,debunk,other,4.0,70.249,debunk,,4.0,130.809,,,,,,,,,,,,,,,,,,,,,,,,,,,,,,,,,,,,,,,,,,,,,,,,,,y
1.51579003429284e+18,2019-07-07,Disinfo: The US promoted von der Leyen to weaken the EU,"US, intended to weaken, EU",,other,,4.0,26.593,,,,,,,,,,,,,,,,,,,,,,,,,,,,,,,,,,,,,,,,,,,,,,,,,,,,,,y
1.51209167659203e+18,2019-06-19,Disinfo: OPCW ignores dissenting report proving Douma chemical attack was staged,"OPCW, ignores, dissenting report about Douma chemical attack being staged",,misinfo,other,2.0,65.103,misinfo,,4.0,46.876,,,,,,,,,,,,,,,,,,,,,,,,,,,,,,,,,,,,,,,,,,,,,,,,,,y
1.50109636733011e+18,2018-10-31,Disinfo: U.S. National Security Advisor Warns Georgia on Suspending Partnership,"U.S National Security Advisor, warns, Georgia on suspending partnership",,other,,5.0,8.989,other,,5.0,17.574,,,,,,,,,,,,,,,,,,,,,,,,,,,,,,,,,,,,,,,,,,,,,,,,,,y
1.56182281247362e+18,2019-08-23,Disinfo: US lieutenant colonel shocked by drunkenness and laziness of Ukraine's soldiers,"US lieutenant colonel, is shocked by, laziness of Ukraine's soldiers",,other,,4.0,20.729,,,,,,,,,,,,,,,,,,,,,,,,,,,,,,,,,,,,,,,,,,,,,,,,,,,,,,y
1.60374282382346e+18,2020-04-01,"Disinfo: Blaming China for COVID-19 is a ploy, like blaming Russia for MH17","Blaming Russia for MH17, is, ploy",hard to decipher their meaning,misinfo,other,3.0,25.914,,,,,,,,,,,,,,,,,,,,,,,,,,,,,,,,,,,,,,,,,,,,,,,,,,,,,,n
1.56454939019022e+18,2019-04-06,"Disinfo: Poland, Hungary increasingly disenchanted with EU rule","Poland, is increasingly disenchanted with, EU rule",reading between the lines it entails,misinfo,other,2.0,39.134,,,,,,,,,,,,,,,,,,,,,,,,,,,,,,,,,,,,,,,,,,,,,,,,,,,,,,y
1.49986571408933e+18,2020-03-03,Disinfo: Unauthorised protesting in Sweden carries a ten-year prison term,"Unauthorised protesting in Sweden, carries, ten-year prison term",,other,,5.0,55.645,other,,5.0,7.373,,,,,,,,,,,,,,,,,,,,,,,,,,,,,,,,,,,,,,,,,,,,,,,,,,y
1.62041386153399e+18,2019-11-11,"Disinfo: Bolivia and Venezuela: Two countries, same US-promoted hybrid war","Bolivia, is involved in, US-promoted hybrid war",,other,,5.0,86.418,,,,,,,,,,,,,,,,,,,,,,,,,,,,,,,,,,,,,,,,,,,,,,,,,,,,,,y
