1.58580513273781e+18,2020-06-29,"Disinfo: As a result of the revolt in the US, pro-Trump whites are marked for political, economic, cultural if not physical extermination","Pro-Trump whites, are marked for, cultural extermination",,,,,,,,,,,,,,,,,,,,,other,,4.0,32.693,,,,,,,,,,,,,,,,,,,,,,,,,,,,,,,,,,,y
1.51243006169735e+18,2019-05-23,Disinfo: Unpublished OPCW report confirms Douma chemical attack staged,"Unpublished OPCW report, confirms, Douma chemical attack staged",,,,,,,,,,,,,,,,,,,,,other,misinfo,2.0,27.759,,,,,,,,,,,,,,,,,,,,,,,,,,,,,,,,,,,y
1.50464174488497e+18,2020-04-30,Disinfo: Microsoft’s patent “666” involves microchipping people to monitor daily activity in exchange for cryptocurrency,"Microsoft's patent ""666"", involves, microchipping people",,,,,,,,,,,,,,,,,,,,,other,,5.0,15.663,other,,4.0,3.896,,,,,,,,,,,,,,,,,,,,,,,,,,,,,,,y
1.61442585164239e+18,2021-05-17,Disinfo: The West is a lawless land and Russia the land of Human Rights and Rule of Law: a comparison of Oleg Sentsov and Julian Assange.,"Russia, is, the land of Human Rights and Rule of Law",,,,,,,,,,,,,,,,,,,,,other,,5.0,12.28,other,,5.0,10.247,,,,,,,,,,,,,,,,,,,,,,,,,,,,,,,y
1.51434430561108e+18,2019-11-14,"Disinfo: 2014 coup in Kyiv led to Crimea referendum, Donbas war","2014 coup in Kyiv, led to, Crimea referendum",,,,,,,,,,,,,,,,,,,,,other,,4.0,26.408,misinfo,other,3.0,15.657,,,,,,,,,,,,,,,,,,,,,,,,,,,,,,,y
1.51019546018678e+18,2019-05-20,"Disinfo: Western funding behind protests in Yekaterinburg, Russia","Western funding, is behind, protests in Yekaterinburg Russia",,,,,,,,,,,,,,,,,,,,,other,,5.0,23.725,,,,,,,,,,,,,,,,,,,,,,,,,,,,,,,,,,,y
1.53863737640197e+18,2021-05-17,Disinfo: The West is a lawless land and Russia the land of Human Rights and Rule of Law: a comparison of Oleg Sentsov and Julian Assange.,"Russia, is, the land of Human Rights and Rule of Law",,,,,,,,,,,,,,,,,,,,,other,,4.0,25.791,,,,,,,,,,,,,,,,,,,,,,,,,,,,,,,,,,,y
1.62329406127991e+18,2020-03-05,Disinfo: The freedom of speech is purged from Western media outlets,"Western media outlets, have purged, the freedom of speech",,,,,,,,,,,,,,,,,,,,,misinfo,,4.0,1406.75,,,,,,,,,,,,,,,,,,,,,,,,,,,,,,,,,,,y
1.5805711831119e+18,2016-01-07,Disinfo: Russian Security Council report warns of downfall of the US...,"Russian Security Council, warns of, downfall of the US",,,,,,,,,,,,,,,,,,,,,other,,4.0,11.926,other,,4.0,8.096,,,,,,,,,,,,,,,,,,,,,,,,,,,,,,,y
1.63166351471165e+18,2020-11-27,"Disinfo: Russia destroyed its Novichok stockpile, but US continues to produce it","Russia, destroyed, its Novichok stockpile",,,,,,,,,,,,,,,,,,,,,other,misinfo,2.0,27.464,,,,,,,,,,,,,,,,,,,,,,,,,,,,,,,,,,,y
1.52320512561946e+18,2021-05-06,"Disinfo: Euromaidan coup led to Crimea referendum, civil war in Donbas","Euromaidan coup, led to, civil war in Donbas",,,,,,,,,,,,,,,,,,,,,debunk,,5.0,78.471,debunk,,5.0,5.792,,,,,,,,,,,,,,,,,,,,,,,,,,,,,,,y
1.52308817211611e+18,2023-01-13,"Disinfo: France, and other Western countries will face war crimes charges in Donetsk","Western countries, will face, war crimes charges in Donetsk",,,,,,,,,,,,,,,,,,,,,other,,4.0,8.765,other,,4.0,6.936,,,,,,,,,,,,,,,,,,,,,,,,,,,,,,,y
1.5776808263719e+18,2019-11-10,"Disinfo: The US has waged a hybrid war against Bolivia, ousting the legitimate President","US, has waged a hybrid war against, Bolivia",,,,,,,,,,,,,,,,,,,,,other,,4.0,5.928,other,,4.0,12.199,,,,,,,,,,,,,,,,,,,,,,,,,,,,,,,y
1.52867315294708e+18,2020-04-15,Disinfo: NATO instructors prepare Ukraine's military to become war criminals,"NATO instructors, prepare, Ukraine's military to become war criminals",,,,,,,,,,,,,,,,,,,,,other,,5.0,20.735,other,,4.0,10.6,,,,,,,,,,,,,,,,,,,,,,,,,,,,,,,y
1.56941245634626e+18,2016-12-03,Disinfo: The UK did not send a single gram of flour to the civilians in Aleppo,"UK, did not send, a single gram of flour to Aleppo civilians",,,,,,,,,,,,,,,,,,,,,other,,4.0,20.496,other,,4.0,9.895,,,,,,,,,,,,,,,,,,,,,,,,,,,,,,,y
1.58030471759845e+18,2019-05-28,Disinfo: EU experts: No Russian meddling in the elections to the European Parliament 2019,"EU experts, found no, Russian meddling in the elections to the European Parliament 2019",,,,,,,,,,,,,,,,,,,,,other,,4.0,42.887,,,,,,,,,,,,,,,,,,,,,,,,,,,,,,,,,,,y
1.62263092025035e+18,2021-01-26,"Disinfo: Liberals want to kill Christians, or at least they want to kill Christian beliefs and practices","Liberals, want to kill, Christians",,,,,,,,,,,,,,,,,,,,,other,,5.0,19.118,other,,4.0,8.264,,,,,,,,,,,,,,,,,,,,,,,,,,,,,,,y
1.60927097540039e+18,2020-03-10,Disinfo: Mainstream media and governments overestimate the coronavirus threat,"Mainstream media, overestimate, the coronavirus threat",,,,,,,,,,,,,,,,,,,,,other,,4.0,18.608,other,,4.0,9.512,,,,,,,,,,,,,,,,,,,,,,,,,,,,,,,y
1.54835635329442e+18,2022-11-18,Disinfo: Kyiv and the West shot down flight MH17 in attempt to kill Putin or discredit Russia,"The West, attempted to discredit, Russia",,,,,,,,,,,,,,,,,,,,,other,,4.0,58.381,,,,,,,,,,,,,,,,,,,,,,,,,,,,,,,,,,,y
1.63233528030364e+18,2020-03-05,Disinfo: The freedom of speech is purged from Western media outlets,"Western media outlets, have purged, the freedom of speech",,,,,,,,,,,,,,,,,,,,,misinfo,,4.0,18.399,misinfo,,5.0,10.295,,,,,,,,,,,,,,,,,,,,,,,,,,,,,,,y
1.61443281627974e+18,2021-01-04,Disinfo: Western élites govern their nations by polarizing society and spreading solitude,"Western elites, govern, their nations by polarizing society",,,,,,,,,,,,,,,,,,,,"idk what this claim triple really means, what does polarizing society mean",other,,1.0,49.713,,,,,,,,,,,,,,,,,,,,,,,,,,,,,,,,,,,y
1.50844258933012e+18,2019-05-31,Disinfo: 9/11 was a Jewish-Zionist job,"9/11, was a job of, Jewish-Zionists",,,,,,,,,,,,,,,,,,,,,other,,4.0,30.296,,,,,,,,,,,,,,,,,,,,,,,,,,,,,,,,,,,y
1.53167738544742e+18,2020-09-08,Disinfo: Germany's Deep State use Navalny to force Merkel to scrap Nord Stream 2,"Germany's Deep State, use, Navalny to force Merkel",,,,,,,,,,,,,,,,,,,,,other,,5.0,30.742,,,,,,,,,,,,,,,,,,,,,,,,,,,,,,,,,,,y
1.5824837802242e+18,2021-01-29,Disinfo: Hi-tech billionaires want to abolish private property except for the super-rich,"Hi-tech billionaires, want to keep private property, for the super-rich",,,,,,,,,,,,,,,,,,,,,misinfo,other,3.0,46.216,other,misinfo,2.0,17.456,,,,,,,,,,,,,,,,,,,,,,,,,,,,,,,y
1.53704128287026e+18,2021-05-17,Disinfo: The West is a lawless land and Russia the land of Human Rights and Rule of Law: a comparison of Oleg Sentsov and Julian Assange.,"The West, is, a lawless land",,,,,,,,,,,,,,,,,,,,,other,,4.0,30.827,,,,,,,,,,,,,,,,,,,,,,,,,,,,,,,,,,,n
1.50847236711831e+18,2022-11-18,Disinfo: Kyiv and the West shot down flight MH17 in attempt to kill Putin or discredit Russia,"Kyiv, attempted to kill, Putin",,,,,,,,,,,,,,,,,,,,,other,,5.0,14.72,other,,4.0,17.919,,,,,,,,,,,,,,,,,,,,,,,,,,,,,,,y
1.57718465619296e+18,2019-12-19,Disinfo: Estonia is afraid of Sputnik's influence,"Estonia, is afraid of, Sputnik's influence",,,,,,,,,,,,,,,,,,,,,other,,5.0,12.088,other,,4.0,8.496,,,,,,,,,,,,,,,,,,,,,,,,,,,,,,,y
1.50632834028583e+18,2021-05-28,Disinfo: The White Helmets and terrorists are preparing a chemical attack in Syria's Idlib,"The White Helmets, are preparing, a chemical attack in Syria's Idlib",,,,,,,,,,,,,,,,,,,,,misinfo,other,3.0,33.542,,,,,,,,,,,,,,,,,,,,,,,,,,,,,,,,,,,y
1.62147934070469e+18,2017-05-23,Disinfo: Washington has plans for preemptive nuclear strikes on Russia and...,"Washington, has plans for, preemptive nuclear strikes on Russia",,,,,,,,,,,,,,,,,,,,,misinfo,,4.0,16.383,other,,4.0,6.799,,,,,,,,,,,,,,,,,,,,,,,,,,,,,,,y
1.58634095949888e+18,2021-07-30,Disinfo: US Democrats stole the 2020 presidential elections,"US Democrats, stole, the 2020 presidential elections",,,,,,,,,,,,,,,,,,,,,misinfo,,5.0,16.027,misinfo,,5.0,11.9,,,,,,,,,,,,,,,,,,,,,,,,,,,,,,,y
1.52338304312522e+18,2020-04-30,Disinfo: Microsoft’s patent “666” involves microchipping people to monitor daily activity in exchange for cryptocurrency,"Microsoft's patent ""666"", is used, to monitor daily activity",,,,,,,,,,,,,,,,,,,,,misinfo,other,3.0,44.871,,,,,,,,,,,,,,,,,,,,,,,,,,,,,,,,,,,y
1.50914529063646e+18,2020-06-30,Disinfo: The Elites have set up a system of cyber-manipulation to monitor citizens’ communication and prevent the universal awakening of mass political consciousness,"System of cyber-manipulation, to monitor, citizens’ communication",,,,,,,,,,,,,,,,,,,,,other,,4.0,15.72,,,,,,,,,,,,,,,,,,,,,,,,,,,,,,,,,,,y
1.6189956318462e+18,2020-12-07,"Disinfo: The “systemic racism” paradigm is deadly for America’s white people, which are disenfranchised and oppressed","""systemic racism"" paradigm, is deadly for, America’s white people",,,,,,,,,,,,,,,,,,,,,other,,4.0,18.983,other,misinfo,3.0,13.216,,,,,,,,,,,,,,,,,,,,,,,,,,,,,,,y
1.59254570288615e+18,2015-11-12,Disinfo: This Week's Trend: Right-wing regime came to power in Kyiv,"Right-wing regime, came to power in, Kyiv",,,,,,,,,,,,,,,,,,,,,misinfo,,4.0,9.96,misinfo,,4.0,8.408,,,,,,,,,,,,,,,,,,,,,,,,,,,,,,,y
1.61217808270166e+18,2023-01-10,Disinfo: SBU digs corpses up to stage provocations and accuse Russia of imaginary war crimes,"SBU, digs up, corpses to stage provocations of imaginary war crimes",,,,,,,,,,,,,,,,,,,,,misinfo,,4.0,35.471,misinfo,,4.0,10.623,,,,,,,,,,,,,,,,,,,,,,,,,,,,,,,y
1.61764997988736e+18,2018-05-24,"Disinfo: No evidence presented by JIT on MH17, only a colorful video based on information fabricated by bloggers from the Bellingcat agency","JIT, presented no evidence on, MH17",,,,,,,,,,,,,,,,,,,,,other,debunk,3.0,26.76,,,,,,,,,,,,,,,,,,,,,,,,,,,,,,,,,,,y
1.55389822990904e+18,2017-05-04,Disinfo: Al Jazeera has filmed staged chemical attacks in Syria,"Al Jazeera, has filmed, staged chemical attacks in Syria",,,,,,,,,,,,,,,,,,,,,other,misinfo,3.0,44.135,other,,4.0,7.496,,,,,,,,,,,,,,,,,,,,,,,,,,,,,,,y
1.56696046616495e+18,2019-07-04,"Disinfo: 2014 Ukrainian coup led to civil war, Crimea referendum","2014 Ukrainian coup, led to, civil war",,,,,,,,,,,,,,,,,,,,,misinfo,,4.0,23.312,misinfo,,5.0,23.903,,,,,,,,,,,,,,,,,,,,,,,,,,,,,,,y
1.5045933307385e+18,2020-08-29,Disinfo: Queensland mass murderer was trained in Ukraine,"Queensland mass murderer, was trained in, Ukraine",,,,,,,,,,,,,,,,,,,,,misinfo,,4.0,37.991,,,,,,,,,,,,,,,,,,,,,,,,,,,,,,,,,,,y
1.50524561409475e+18,2021-01-15,Disinfo: Democrats suppress dissent and violate human rights in the US,"Democrats, suppress, dissent in the US",,,,,,,,,,,,,,,,,,,,,misinfo,,5.0,9.487,,,,,,,,,,,,,,,,,,,,,,,,,,,,,,,,,,,y
1.57166e+18,2019-03-18,Disinfo: Crimean economy booming since reunion with Russia,"Crimean economy, is booming, since reunion with Russia",,,,,,,,,,,,,,,,,,,,,other,,5.0,13.33,other,,4.0,6.224,,,,,,,,,,,,,,,,,,,,,,,,,,,,,,,y
1.52891026946805e+18,2020-01-14,"Disinfo: PS752: Iranian elites attempt to betray Iraq, Syria, Palestine and their own people","Iranian elites, attempt to betray, Iraq",,,,,,,,,,,,,,,,,,,,,other,,4.0,37.939,other,,4.0,15.079,,,,,,,,,,,,,,,,,,,,,,,,,,,,,,,y
1.52297472147794e+18,2020-04-06,Disinfo: Moscow Mayor is connected to neo-liberal circles and supports the hysteria over the COVID-19,"Moscow Mayor, is connected to, neo-liberal circles",,,,,,,,,,,,,,,,,,,,,other,,2.0,63.668,other,,4.0,9.255,,,,,,,,,,,,,,,,,,,,,,,,,,,,,,,y
1.52859740729401e+18,2015-11-13,Disinfo: 22-minute-video devoted to Litvinenko case in the UK,"22-minute-video, is devoted to, Litvinenko case in the UK",,,,,,,,,,,,,,,,,,,,,other,,4.0,10.819,,,,,,,,,,,,,,,,,,,,,,,,,,,,,,,,,,,y
1.555394351937e+18,2021-10-29,"Disinfo: Ukraine's Euromaidan coup led to civil war, Crimea's reunification with Russia","Ukraine's Euromaidan coup, led to, civil war",,,,,,,,,,,,,,,,,,,,,debunk,,5.0,11.034,,,,,,,,,,,,,,,,,,,,,,,,,,,,,,,,,,,y
1.5706863840921e+18,2021-01-15,Disinfo: Democrats suppress dissent and violate human rights in the US,"Democrats, violate, human rights in the US",,,,,,,,,,,,,,,,,,,,,other,,5.0,12.699,other,,4.0,27.768,,,,,,,,,,,,,,,,,,,,,,,,,,,,,,,y
1.56571687974586e+18,2021-01-09,Disinfo: The ”Deep State” lured the passionate protestors into storming the Capitol,"""Deep State"", lured, passionate protestors into storming the Capitol",,,,,,,,,,,,,,,,,,,,,other,,4.0,33.407,,,,,,,,,,,,,,,,,,,,,,,,,,,,,,,,,,,y
1.51413797633859e+18,2021-01-14,"Disinfo: Ukraine, not Russia, is the perpetrator of human rights abuses in Crimea","Russia, is not, perpetrator of human rights abuses in Crimea",,,,,,,,,,,,,,,,,,,,,debunk,,4.0,79.917,,,,,,,,,,,,,,,,,,,,,,,,,,,,,,,,,,,y
1.56239506976816e+18,2016-11-30,Disinfo: The EU’s ban on issuing visas to Russians in Crimea is a violation of human rights,"EU's ban on issuing visas to Russians in Crimea, is a violation, of human rights",,,,,,,,,,,,,,,,,,,,,other,,4.0,26.255,,,,,,,,,,,,,,,,,,,,,,,,,,,,,,,,,,,y
1.51274800591665e+18,2017-09-01,Disinfo: A man was fined for eating bacon in front of Muslims in Sweden,"A man, was fined, for eating bacon in front of Muslims in Sweden",,,,,,,,,,,,,,,,,,,,,misinfo,,5.0,15.031,,,,,,,,,,,,,,,,,,,,,,,,,,,,,,,,,,,y
1.58585198143585e+18,2017-12-14,Disinfo: The Russian Army is not involved in the war in Ukraine,"Russian Army, is not, involved in war in Ukraine",,,,,,,,,,,,,,,,,,,,,other,,5.0,129.249,,,,,,,,,,,,,,,,,,,,,,,,,,,,,,,,,,,y
1.60850783359065e+18,2020-06-29,"Disinfo: As a result of the revolt in the US, pro-Trump whites are marked for political, economic, cultural if not physical extermination","Pro-Trump whites, are marked for, cultural extermination",,,,,,,,,,,,,,,,,,,,,other,,5.0,22.366,,,,,,,,,,,,,,,,,,,,,,,,,,,,,,,,,,,y
1.60922080833689e+18,2022-05-24,Disinfo: Russian operation in Ukraine to protect Donbas from genocide,"Donbas, is protected from, genocide",,,,,,,,,,,,,,,,,,,,,debunk,other,3.0,42.467,,,,,,,,,,,,,,,,,,,,,,,,,,,,,,,,,,,y
1.5265405231331e+18,2020-10-26,Disinfo: Moldova could be the target of Western-backed colour revolution to pressure Russia,"Western-backed colour revolution, to pressure, Russia",,,,,,,,,,,,,,,,,,,,,misinfo,other,3.0,35.575,,,,,,,,,,,,,,,,,,,,,,,,,,,,,,,,,,,n
1.50882300193186e+18,2019-07-25,Disinfo: US Senate finds no proof of Russian meddling in 2016 presidential election,"US Senate, finds, no proof of Russian meddling in 2016 presidential election",,,,,,,,,,,,,,,,,,,,,debunk,,4.0,48.359,,,,,,,,,,,,,,,,,,,,,,,,,,,,,,,,,,,y
1.55160928375797e+18,2016-02-03,Disinfo: Zika virus is owned by American and British companies and...,"British companies, own, Zika virus",,,,,,,,,,,,,,,,,,,,,other,,5.0,33.546,,,,,,,,,,,,,,,,,,,,,,,,,,,,,,,,,,,y
1.58862967026577e+18,2018-10-31,Disinfo: U.S. National Security Advisor Warns Georgia on Suspending Partnership,"U.S National Security Advisor, warns, Georgia on suspending partnership",,,,,,,,,,,,,,,,,,,,,other,,5.0,10.032,other,,4.0,10.824,,,,,,,,,,,,,,,,,,,,,,,,,,,,,,,y
1.50675986313291e+18,2019-03-11,"Disinfo: US-led coalition strike in Syria targets civilians, killing 50","US-led coalition, targets, civilians in Syria",,,,,,,,,,,,,,,,,,,,,other,,4.0,18.839,,,,,,,,,,,,,,,,,,,,,,,,,,,,,,,,,,,y
1.50920346967621e+18,2020-02-13,Disinfo: The West falsely accuses Russia of election meddling,"The West, falsely accuses, Russia of election meddling",,,,,,,,,,,,,,,,,,,,,other,,5.0,14.872,,,,,,,,,,,,,,,,,,,,,,,,,,,,,,,,,,,y
1.61361327390717e+18,2020-11-09,Disinfo: The United States is a failed state and is unable to control its own electoral process,"The United States, is, a failed state",,,,,,,,,,,,,,,,,,,,,misinfo,,5.0,7.648,misinfo,,5.0,5.407,,,,,,,,,,,,,,,,,,,,,,,,,,,,,,,y
1.54025509053948e+18,2022-12-06,Disinfo: There is no press freedom in the West,"West, has, no press freedom",,,,,,,,,,,,,,,,,,,,,misinfo,,4.0,14.799,,,,,,,,,,,,,,,,,,,,,,,,,,,,,,,,,,,y
1.58340511079679e+18,2020-07-20,Disinfo: Russia does not interfere in other countries sovereign affairs,"Russia, does not interfere, in other countries sovereign affairs",,,,,,,,,,,,,,,,,,,,,debunk,misinfo,3.0,33.561,debunk,,4.0,12.503,,,,,,,,,,,,,,,,,,,,,,,,,,,,,,,y
1.59299601250295e+18,2022-05-22,Disinfo: NATO expansion to increase tension in the region,"NATO expansion, to increase, tension in the region",,,,,,,,,,,,,,,,,,,,,misinfo,,4.0,16.751,,,,,,,,,,,,,,,,,,,,,,,,,,,,,,,,,,,y
1.58975390680838e+18,2016-09-13,Disinfo: Zbigniew Brzezinski says that the US is behind the coup in Turkey,"Zbigniew Brzezinski, says, the US is behind the coup in Turkey",,,,,,,,,,,,,,,,,,,,,other,,5.0,41.21,,,,,,,,,,,,,,,,,,,,,,,,,,,,,,,,,,,y
1.55221763618389e+18,2021-02-08,Disinfo: Josep Borrell doesn't have a freedom to choose an independent political course,"Josep Borrell, doesn't have, a freedom to choose an independent political course",,,,,,,,,,,,,,,,,,,,,other,,5.0,15.336,other,,4.0,38.239,,,,,,,,,,,,,,,,,,,,,,,,,,,,,,,y
1.5155790113842e+18,2020-02-07,Disinfo: Scientific evidence is mounting that the coronavirus is man made and targeting the Chinese race,"The coronavirus, is targeting, the Chinese race",,,,,,,,,,,,,,,,,,,,,other,,4.0,16.584,,,,,,,,,,,,,,,,,,,,,,,,,,,,,,,,,,,y
1.55185911865854e+18,2019-11-11,"Disinfo: Bolivia and Venezuela: Two countries, same US-promoted hybrid war","Bolivia, is involved in, US-promoted hybrid war",,,,,,,,,,,,,,,,,,,,,other,,5.0,8.71,other,,4.0,402.192,,,,,,,,,,,,,,,,,,,,,,,,,,,,,,,y
1.55013356761482e+18,2016-04-12,Disinfo: There are no US citizens in the Panama Papers which proves it was a CIA operation,"No US citizens, are in, Panama Papers",,,,,,,,,,,,,,,,,,,,,other,,5.0,41.109,other,,4.0,6.904,,,,,,,,,,,,,,,,,,,,,,,,,,,,,,,y
1.50942025238324e+18,2020-02-13,Disinfo: The West falsely accuses Russia of election meddling,"Russia, falsely accused of, election meddling",,,,,,,,,,,,,,,,,,,,,other,,5.0,7.887,other,,5.0,4.064,,,,,,,,,,,,,,,,,,,,,,,,,,,,,,,y
1.57606092408705e+18,2019-04-06,"Disinfo: Poland, Hungary increasingly disenchanted with EU rule","Hungary, is increasingly disenchanted with, EU rule",,,,,,,,,,,,,,,,,,,,,other,,4.0,17.896,,,,,,,,,,,,,,,,,,,,,,,,,,,,,,,,,,,y
1.53085010449582e+18,2019-01-14,Disinfo: A concerted campaign against Russia and Russian people in the US and UK,"US, is conducting a concerted campaign, against Russia",,,,,,,,,,,,,,,,,,,,,other,,4.0,7.975,,,,,,,,,,,,,,,,,,,,,,,,,,,,,,,,,,,y
1.50512023811931e+18,2017-11-14,Disinfo: Sweden under pressure to adopt Islamic national flag,"Sweden, under pressure to adopt, Islamic national flag",,,,,,,,,,,,,,,,,,,,,other,,5.0,11.479,other,,4.0,9.56,,,,,,,,,,,,,,,,,,,,,,,,,,,,,,,y
1.57276484723817e+18,2019-04-25,Disinfo: Kurt Volker is funded by Poroshenko,"Kurt Volker, is funded by, Poroshenko",,,,,,,,,,,,,,,,,,,,,other,,5.0,40.273,other,,4.0,11.072,,,,,,,,,,,,,,,,,,,,,,,,,,,,,,,y
1.50262777657022e+18,2019-10-07,Disinfo: NATO forced Ukraine to adopt anti-Russian foreign policy,"NATO, forced, Ukraine to adopt anti-Russian foreign policy",,,,,,,,,,,,,,,,,,,,,other,,4.0,19.591,other,,4.0,18.176,,,,,,,,,,,,,,,,,,,,,,,,,,,,,,,y
1.50517534793084e+18,2018-06-08,Disinfo: A child died during NATO military exercise in Lithuania,"A child, died during, NATO military exercise in Lithuania",,,,,,,,,,,,,,,,,,,,,other,,4.0,10.476,other,,4.0,10.2,,,,,,,,,,,,,,,,,,,,,,,,,,,,,,,y
1.50139428570218e+18,2020-11-20,Disinfo: US Army raided a CIA facility in Germany to seize Dominion servers,"US Army, raided, a CIA facility in Germany to seize Dominion servers",,,,,,,,,,,,,,,,,,,,,debunk,other,3.0,28.912,other,,4.0,10.064,,,,,,,,,,,,,,,,,,,,,,,,,,,,,,,y
1.59316635533472e+18,2019-03-28,Disinfo: Main reason for MH17 crash is Ukraine's failure to close airspace,"MH17 crash, is due to, Ukraine's failure to close airspace",,,,,,,,,,,,,,,,,,,,,other,,5.0,21.777,misinfo,,4.0,8.872,,,,,,,,,,,,,,,,,,,,,,,,,,,,,,,y
1.56002461933107e+18,2021-09-30,Disinfo: YouTube blocked RT German-language channels with the backing of the German government,"YouTube backed by German government, blocked, RT (Russia Today) German-language channels",,,,,,,,,,,,,,,,,,,,,other,,5.0,20.007,,,,,,,,,,,,,,,,,,,,,,,,,,,,,,,,,,,y
1.56827399186511e+18,2021-01-04,Disinfo: Western élites govern their nations by polarizing society and spreading solitude,"Western elites, govern, their nations by polarizing society",,,,,,,,,,,,,,,,,,,,,misinfo,,5.0,145.863,misinfo,other,2.0,19.479,,,,,,,,,,,,,,,,,,,,,,,,,,,,,,,y
1.50201655827679e+18,2022-06-08,Disinfo: Western civil aviation sanctions are illegitimate,"Western civil aviation sanctions, are, illegitimate",,,,,,,,,,,,,,,,,,,,,misinfo,,5.0,18.639,misinfo,,5.0,7.352,,,,,,,,,,,,,,,,,,,,,,,,,,,,,,,y
1.55660288714882e+18,2021-03-22,Disinfo: The West constantly demonises Putin and Russia,"The West, constantly demonises, Putin",,,,,,,,,,,,,,,,,,,,,misinfo,,5.0,9.472,,,,,,,,,,,,,,,,,,,,,,,,,,,,,,,,,,,y
1.60643516880142e+18,2021-01-15,Disinfo: Democrats suppress dissent and violate human rights in the US,"Democrats, violate, human rights in the US",,,,,,,,,,,,,,,,,,,,,other,,5.0,12.735,other,,4.0,7.952,,,,,,,,,,,,,,,,,,,,,,,,,,,,,,,y
1.49976149243826e+18,2016-04-12,Disinfo: There are no US citizens in the Panama Papers which proves it was a CIA operation,"No US citizens, are in, Panama Papers",,,,,,,,,,,,,,,,,,,,,other,,4.0,16.76,other,,4.0,10.704,,,,,,,,,,,,,,,,,,,,,,,,,,,,,,,y
1.63529921339429e+18,2016-06-10,Disinfo: The Crimean referendum of March 2014 was legitimate,"The Crimean referendum of March 2014, was, legitimate",,,,,,,,,,,,,,,,,,,,,debunk,,5.0,67.121,,,,,,,,,,,,,,,,,,,,,,,,,,,,,,,,,,,y
1.57267932007775e+18,2022-06-03,"Disinfo: EU, Europe, NATO hamper peaceful solution in Ukraine","NATO, hampers, peaceful solution in Ukraine",,,,,,,,,,,,,,,,,,,,,other,,5.0,81.363,,,,,,,,,,,,,,,,,,,,,,,,,,,,,,,,,,,y
1.50199834615146e+18,2017-05-04,Disinfo: Al Jazeera has filmed staged chemical attacks in Syria,"Al Jazeera, has filmed, staged chemical attacks in Syria",,,,,,,,,,,,,,,,,,,,,other,,4.0,24.663,other,,4.0,14.983,,,,,,,,,,,,,,,,,,,,,,,,,,,,,,,y
1.62051612213841e+18,2019-11-11,"Disinfo: Bolivia and Venezuela: Two countries, same US-promoted hybrid war","Bolivia, is involved in, US-promoted hybrid war",,,,,,,,,,,,,,,,,,,,,other,,4.0,10.158,,,,,,,,,,,,,,,,,,,,,,,,,,,,,,,,,,,y
1.53052711574096e+18,2018-11-08,Disinfo: Finnish Orthodox Church denies claims on support for Ukrainian Church's autonomy,"Finnish Orthodox Church, denies, claims on support for Ukrainian Church's autonomy",,,,,,,,,,,,,,,,,,,,,other,,4.0,26.936,other,,4.0,10.52,,,,,,,,,,,,,,,,,,,,,,,,,,,,,,,y
1.53872715894791e+18,2019-12-11,Disinfo: Mueller report contains no evidence of Russian meddling in 2016 US election,"Mueller report, does not contain, evidence of Russian meddling in 2016 US election",,,,,,,,,,,,,,,,,,,,,debunk,,4.0,33.878,debunk,,4.0,16.919,,,,,,,,,,,,,,,,,,,,,,,,,,,,,,,y
1.6315476585307e+18,2016-03-22,Disinfo: One in three Europeans consider Crimea a part of Russia...,"One in three Europeans, consider, Crimea a part of Russia",,,,,,,,,,,,,,,,,,,,,other,,5.0,14.451,,,,,,,,,,,,,,,,,,,,,,,,,,,,,,,,,,,y
1.53289906058721e+18,2020-11-23,Disinfo: The sexual revolution has killed more people than the Russian and the Chinese communist revolutions,"Sexual revolution, has killed more people than, Chinese communist revolution",,,,,,,,,,,,,,,,,,,,,other,,4.0,13.287,,,,,,,,,,,,,,,,,,,,,,,,,,,,,,,,,,,y
1.55111753037852e+18,2017-12-09,Disinfo: Ukrainian Army uses white phosphorous,"Ukrainian Army, uses, white phosphorous",,,,,,,,,,,,,,,,,,,,,misinfo,,5.0,8.399,misinfo,,5.0,9.719,,,,,,,,,,,,,,,,,,,,,,,,,,,,,,,y
1.52410242337933e+18,2019-09-06,Disinfo: Climate activists and complicit media manipulate scientific data to impose green dictatorship,"Climate activists, manipulate, scientific data to impose green dictatorship",,,,,,,,,,,,,,,,,,,,,misinfo,,2.0,111.415,other,,4.0,10.911,,,,,,,,,,,,,,,,,,,,,,,,,,,,,,,y
1.60483314803818e+18,2019-03-18,Disinfo: The US military has stolen 50 tons of gold from Syria,"US military, has stolen, 50 tons of gold from Syria",,,,,,,,,,,,,,,,,,,,,other,,5.0,14.199,,,,,,,,,,,,,,,,,,,,,,,,,,,,,,,,,,,y
1.54551258554552e+18,2021-07-30,Disinfo: US Democrats stole the 2020 presidential elections,"US Democrats, stole, the 2020 presidential elections",,,,,,,,,,,,,,,,,,,,,misinfo,,5.0,10.268,,,,,,,,,,,,,,,,,,,,,,,,,,,,,,,,,,,y
1.5247498548277e+18,2021-03-22,Disinfo: The US goal of global hegemony could lead to nuclear war with Russia,"US goal of global hegemony, could lead to, nuclear war with Russia",,,,,,,,,,,,,,,,,,,,,misinfo,,5.0,18.973,,,,,,,,,,,,,,,,,,,,,,,,,,,,,,,,,,,y
1.56582544519899e+18,2020-04-03,Disinfo: The coronavirus pandemic may be used to introduce absolute social control,"Coronavirus pandemic, may be used to introduce, absolute social control",,,,,,,,,,,,,,,,,,,,,debunk,,5.0,28.544,,,,,,,,,,,,,,,,,,,,,,,,,,,,,,,,,,,y
1.52043170454815e+18,2020-11-23,Disinfo: The sexual revolution has killed more people than the Russian and the Chinese communist revolutions,"Sexual revolution, has killed more people than, Chinese communist revolution",,,,,,,,,,,,,,,,,,,,,other,,4.0,16.544,other,,4.0,9.487,,,,,,,,,,,,,,,,,,,,,,,,,,,,,,,y
1.61536393547286e+18,2021-01-09,Disinfo: The ”Deep State” lured the passionate protestors into storming the Capitol,"""Deep State"", lured, passionate protestors into storming the Capitol",,,,,,,,,,,,,,,,,,,,,other,,1.0,60.375,other,,4.0,5.655,,,,,,,,,,,,,,,,,,,,,,,,,,,,,,,y
1.50219993908597e+18,2017-11-24,"Disinfo: Georgian sniper trio killed demonstrators on Euromaidan, operation was initiated by the former president of Georgia Mikheil Saakashvili","Operation to kill demonstrators on Euromaidan, was initiated by, the former president of Georgia Mikheil Saakashvili",,,,,,,,,,,,,,,,,,,,,other,,5.0,16.946,other,,4.0,12.784,,,,,,,,,,,,,,,,,,,,,,,,,,,,,,,y
1.60580111821002e+18,2021-01-04,Disinfo: Western élites govern their nations by polarizing society and spreading solitude,"Western elites, govern, their nations by polarizing society",,,,,,,,,,,,,,,,,,,,,other,,4.0,8.815,other,misinfo,2.0,10.848,,,,,,,,,,,,,,,,,,,,,,,,,,,,,,,y
